{
  "$schema": "https://raw.githubusercontent.com/BGA360/bridgenta-portfolio/main/registry/certified-projects.schema.json",
  "registry_version": "v2.3",
  "status": "OPERATIONAL",
  "last_updated": "2026-07-20T07:54:23Z",
  "total_certified_projects": 5,
  "projects": [
    {
      "certificate_id": "BECC-CERT-2026-001",
      "project_name": "bridgenta-portfolio",
      "repository_url": "https://github.com/BGA360/bridgenta-portfolio",
      "evaluated_commit_sha": "ae103abf4027bc991a027e1f40958a032d90956b",
      "project_version": "v1.0.0",
      "framework_version": "BECC v2.2 GA",
      "certification_scope": "Full Documentation Suite & Core Runtime API Specifications",
      "certification_status": "Certified",
      "issue_date": "2026-07-19",
      "valid_until": "2027-07-19",
      "reassessment_date": "2027-06-19",
      "certification_authority": "BridGenta Governance Board",
      "evidence_package": "docs/engineering-communication/stewardship/operations/AC-001/",
      "historical_notes": [
        {
          "timestamp": "2026-07-19T10:00:00Z",
          "action": "ISSUED",
          "details": "Initial BECC v2.2 GA certification granted following adoption audit."
        },
        {
          "timestamp": "2026-07-19T19:37:05Z",
          "action": "REGISTERED",
          "details": "Established as Registry Entry #001 in BECC Certified Project Registry."
        }
      ]
    },
    {
      "certificate_id": "BECC-CERT-2026-002",
      "project_name": "lumina-praxis",
      "repository_url": "https://github.com/BGA360/bridgenta-portfolio",
      "evaluated_commit_sha": "ae103abf4027bc991a027e1f40958a032d90956b",
      "project_version": "v1.0.0",
      "framework_version": "BECC v2.3",
      "certification_scope": "Public Case Study, Medical Web Portal Architecture & Accessibility Specifications",
      "certification_status": "Certified",
      "issue_date": "2026-07-20",
      "valid_until": "2027-07-20",
      "reassessment_date": "2027-06-20",
      "certification_authority": "BECC Certification Authority & Governance Board",
      "evidence_package": "BECC-LUMINA-PRAXIS-FINAL-CERTIFICATION.md",
      "historical_notes": [
        {
          "timestamp": "2026-07-20T00:19:00Z",
          "action": "ASSESSED",
          "details": "Completed OP-002 Independent Assessment; logged findings FIND-LP-001 through FIND-LP-004."
        },
        {
          "timestamp": "2026-07-20T00:47:00Z",
          "action": "PLANNED",
          "details": "Formulated OP-003 Improvement Implementation Plan with Work Packages WP-LP-001 through WP-LP-004."
        },
        {
          "timestamp": "2026-07-20T00:55:00Z",
          "action": "REMEDIATED",
          "details": "Executed documentation remediations adding mandatory Validation, Risks, and References sections."
        },
        {
          "timestamp": "2026-07-20T01:00:00Z",
          "action": "VERIFIED",
          "details": "Completed OP-004 Independent Verification Report; confirmed 100% compliance."
        },
        {
          "timestamp": "2026-07-20T03:22:28Z",
          "action": "CERTIFIED",
          "details": "Issued BECC Constitutional Certification BECC-CERT-2026-002; registered as Entry #002."
        }
      ]
    },
    {
      "certificate_id": "BECC-CERT-2026-003",
      "project_name": "starcleaners",
      "repository_url": "https://github.com/BGA360/bridgenta-portfolio",
      "evaluated_commit_sha": "ae103abf4027bc991a027e1f40958a032d90956b",
      "project_version": "v1.0.0",
      "framework_version": "BECC v2.3",
      "certification_scope": "Public Case Study, Luxury PWA Architecture & Local SEO Specifications",
      "certification_status": "Certified",
      "issue_date": "2026-07-20",
      "valid_until": "2027-07-20",
      "reassessment_date": "2027-06-20",
      "certification_authority": "BECC Certification Authority & Governance Board",
      "evidence_package": "BECC-STARCLEANERS-FINAL-CERTIFICATION.md",
      "historical_notes": [
        {
          "timestamp": "2026-07-20T01:29:00Z",
          "action": "ASSESSED",
          "details": "Completed OP-002 Independent Assessment; logged findings FIND-SC-001 through FIND-SC-004."
        },
        {
          "timestamp": "2026-07-20T01:35:00Z",
          "action": "PLANNED",
          "details": "Formulated OP-003 Improvement Implementation Plan with Work Packages WP-SC-001 through WP-SC-004."
        },
        {
          "timestamp": "2026-07-20T01:42:00Z",
          "action": "REMEDIATED",
          "details": "Executed documentation remediations adding mandatory Validation, Risks, and References sections."
        },
        {
          "timestamp": "2026-07-20T01:47:00Z",
          "action": "VERIFIED",
          "details": "Completed OP-004 Independent Verification Report; confirmed 100% compliance."
        },
        {
          "timestamp": "2026-07-20T03:54:42Z",
          "action": "CERTIFIED",
          "details": "Issued BECC Constitutional Certification BECC-CERT-2026-003; registered as Entry #003."
        }
      ]
    },
    {
      "certificate_id": "BECC-CERT-2026-004",
      "project_name": "rootedrealitygarden",
      "repository_url": "https://github.com/BGA360/bridgenta-portfolio",
      "evaluated_commit_sha": "ae103abf4027bc991a027e1f40958a032d90956b",
      "project_version": "v1.0.0",
      "framework_version": "BECC v2.3",
      "certification_scope": "Public Case Study, Ecological Design Portal & Automated Technical SEO/AEO Specifications",
      "certification_status": "Certified",
      "issue_date": "2026-07-20",
      "valid_until": "2027-07-20",
      "reassessment_date": "2027-06-20",
      "certification_authority": "BECC Certification Authority & Governance Board",
      "evidence_package": "BECC-ROOTED-REALITY-GARDENS-FINAL-CERTIFICATION.md",
      "historical_notes": [
        {
          "timestamp": "2026-07-20T01:59:00Z",
          "action": "ASSESSED",
          "details": "Completed OP-002 Independent Assessment; logged findings FIND-RRG-001 through FIND-RRG-004."
        },
        {
          "timestamp": "2026-07-20T02:05:00Z",
          "action": "PLANNED",
          "details": "Formulated OP-003 Improvement Implementation Plan with Work Packages WP-RRG-001 through WP-RRG-004."
        },
        {
          "timestamp": "2026-07-20T02:10:00Z",
          "action": "REMEDIATED",
          "details": "Executed documentation remediations adding mandatory Validation, Risks, and References sections."
        },
        {
          "timestamp": "2026-07-20T02:18:00Z",
          "action": "VERIFIED",
          "details": "Completed OP-004 Independent Verification Report; confirmed 100% compliance."
        },
        {
          "timestamp": "2026-07-20T04:23:23Z",
          "action": "CERTIFIED",
          "details": "Issued BECC Constitutional Certification BECC-CERT-2026-004; registered as Entry #004."
        }
      ]
    },
    {
      "certificate_id": "BECC-CERT-2026-005",
      "project_name": "aeocortex",
      "repository_url": "https://github.com/BGA360/bridgenta-portfolio",
      "evaluated_commit_sha": "ae103abf4027bc991a027e1f40958a032d90956b",
      "project_version": "v1.0.0",
      "framework_version": "BECC v2.3",
      "certification_scope": "Public Case Study, AI Search Engine Optimization (AEO/GEO) & Node.js Parser Specifications",
      "certification_status": "Certified",
      "issue_date": "2026-07-20",
      "valid_until": "2027-07-20",
      "reassessment_date": "2027-06-20",
      "certification_authority": "BECC Certification Authority & Governance Board",
      "evidence_package": "BECC-AEOCORTEX-FINAL-CERTIFICATION.md",
      "historical_notes": [
        {
          "timestamp": "2026-07-20T07:16:00Z",
          "action": "ASSESSED",
          "details": "Completed OP-002 Independent Assessment; logged findings FIND-AEO-001 through FIND-AEO-003."
        },
        {
          "timestamp": "2026-07-20T07:28:00Z",
          "action": "PLANNED",
          "details": "Formulated OP-003 Improvement Implementation Plan with Work Packages WP-AEO-001 through WP-AEO-003."
        },
        {
          "timestamp": "2026-07-20T07:43:00Z",
          "action": "REMEDIATED",
          "details": "Executed documentation remediations standardizing heading to Risks & Mitigations, adding commit SHA metadata, and removing pilot annotations."
        },
        {
          "timestamp": "2026-07-20T07:49:00Z",
          "action": "VERIFIED",
          "details": "Completed OP-004 Independent Verification Report; confirmed 100% compliance."
        },
        {
          "timestamp": "2026-07-20T07:54:23Z",
          "action": "CERTIFIED",
          "details": "Issued BECC Constitutional Certification BECC-CERT-2026-005; registered as Entry #005."
        }
      ]
    }
  ]
}
